
Bus 001 Device 004: ID 1e71:170e NZXT 
Device Descriptor:
  bLength                18
  bDescriptorType         1
  bcdUSB               2.00
  bDeviceClass            0 
  bDeviceSubClass         0 
  bDeviceProtocol         0 
  bMaxPacketSize0        64
  idVendor           0x1e71 NZXT
  idProduct          0x170e 
  bcdDevice            2.00
  iManufacturer           1 NZXT.-Inc.
  iProduct                2 NZXT USB Device
  iSerial                 3 49874481333
  bNumConfigurations      1
  Configuration Descriptor:
    bLength                 9
    bDescriptorType         2
    wTotalLength       0x0029
    bNumInterfaces          1
    bConfigurationValue     1
    iConfiguration          0 
    bmAttributes         0xc0
      Self Powered
    MaxPower              100mA
    Interface Descriptor:
      bLength                 9
      bDescriptorType         4
      bInterfaceNumber        0
      bAlternateSetting       0
      bNumEndpoints           2
      bInterfaceClass         3 Human Interface Device
      bInterfaceSubClass      0 
      bInterfaceProtocol      0 
      iInterface              0 
        HID Device Descriptor:
          bLength                 9
          bDescriptorType        33
          bcdHID               1.10
          bCountryCode            0 Not supported
          bNumDescriptors         1
          bDescriptorType        34 Report
          wDescriptorLength     143
          Report Descriptor: (length is 143)
            Item(Global): Usage Page, data= [ 0x00 0xff ] 65280
                            (null)
            Item(Local ): Usage, data= [ 0x01 ] 1
                            (null)
            Item(Main  ): Collection, data= [ 0x01 ] 1
                            Application
            Item(Global): Report ID, data= [ 0x01 ] 1
            Item(Local ): Usage, data= [ 0x01 ] 1
                            (null)
            Item(Global): Logical Minimum, data= [ 0x00 ] 0
            Item(Global): Logical Maximum, data= [ 0xff 0x00 ] 255
            Item(Global): Report Size, data= [ 0x08 ] 8
            Item(Global): Report Count, data= [ 0x01 ] 1
            Item(Main  ): Feature, data= [ 0x82 ] 130
                            Data Variable Absolute No_Wrap Linear
                            Preferred_State No_Null_Position Volatile Bitfield
            Item(Global): Report ID, data= [ 0x01 ] 1
            Item(Local ): Usage, data= [ 0x01 ] 1
                            (null)
            Item(Main  ): Output, data= [ 0x82 ] 130
                            Data Variable Absolute No_Wrap Linear
                            Preferred_State No_Null_Position Volatile Bitfield
            Item(Global): Report ID, data= [ 0x02 ] 2
            Item(Local ): Usage, data= [ 0x02 ] 2
                            (null)
            Item(Global): Logical Minimum, data= [ 0x00 ] 0
            Item(Global): Logical Maximum, data= [ 0xff 0x00 ] 255
            Item(Global): Report Size, data= [ 0x08 ] 8
            Item(Global): Report Count, data= [ 0x40 ] 64
            Item(Main  ): Feature, data= [ 0x82 ] 130
                            Data Variable Absolute No_Wrap Linear
                            Preferred_State No_Null_Position Volatile Bitfield
            Item(Global): Report ID, data= [ 0x02 ] 2
            Item(Local ): Usage, data= [ 0x02 ] 2
                            (null)
            Item(Main  ): Output, data= [ 0x82 ] 130
                            Data Variable Absolute No_Wrap Linear
                            Preferred_State No_Null_Position Volatile Bitfield
            Item(Global): Report ID, data= [ 0x03 ] 3
            Item(Local ): Usage, data= [ 0x03 ] 3
                            (null)
            Item(Global): Logical Minimum, data= [ 0x00 ] 0
            Item(Global): Logical Maximum, data= [ 0xff 0x00 ] 255
            Item(Global): Report Size, data= [ 0x08 ] 8
            Item(Global): Report Count, data= [ 0x40 ] 64
            Item(Main  ): Feature, data= [ 0x82 ] 130
                            Data Variable Absolute No_Wrap Linear
                            Preferred_State No_Null_Position Volatile Bitfield
            Item(Global): Report ID, data= [ 0x03 ] 3
            Item(Local ): Usage, data= [ 0x03 ] 3
                            (null)
            Item(Main  ): Output, data= [ 0x82 ] 130
                            Data Variable Absolute No_Wrap Linear
                            Preferred_State No_Null_Position Volatile Bitfield
            Item(Global): Report ID, data= [ 0xf0 ] 240
            Item(Local ): Usage, data= [ 0x04 ] 4
                            (null)
            Item(Global): Logical Minimum, data= [ 0x00 ] 0
            Item(Global): Logical Maximum, data= [ 0xff 0x00 ] 255
            Item(Global): Report Size, data= [ 0x08 ] 8
            Item(Global): Report Count, data= [ 0x40 ] 64
            Item(Main  ): Feature, data= [ 0x82 ] 130
                            Data Variable Absolute No_Wrap Linear
                            Preferred_State No_Null_Position Volatile Bitfield
            Item(Global): Report ID, data= [ 0xf0 ] 240
            Item(Local ): Usage, data= [ 0x04 ] 4
                            (null)
            Item(Main  ): Output, data= [ 0x82 ] 130
                            Data Variable Absolute No_Wrap Linear
                            Preferred_State No_Null_Position Volatile Bitfield
            Item(Global): Report ID, data= [ 0x10 ] 16
            Item(Local ): Usage, data= [ 0x05 ] 5
                            (null)
            Item(Global): Logical Minimum, data= [ 0x00 ] 0
            Item(Global): Logical Maximum, data= [ 0xff 0x00 ] 255
            Item(Global): Report Size, data= [ 0x08 ] 8
            Item(Global): Report Count, data= [ 0x40 ] 64
            Item(Main  ): Feature, data= [ 0x82 ] 130
                            Data Variable Absolute No_Wrap Linear
                            Preferred_State No_Null_Position Volatile Bitfield
            Item(Global): Report ID, data= [ 0x10 ] 16
            Item(Local ): Usage, data= [ 0x05 ] 5
                            (null)
            Item(Main  ): Output, data= [ 0x82 ] 130
                            Data Variable Absolute No_Wrap Linear
                            Preferred_State No_Null_Position Volatile Bitfield
            Item(Global): Report ID, data= [ 0xf1 ] 241
            Item(Local ): Usage, data= [ 0x06 ] 6
                            (null)
            Item(Global): Report Size, data= [ 0x08 ] 8
            Item(Global): Report Count, data= [ 0x3f ] 63
            Item(Main  ): Input, data= [ 0x82 ] 130
                            Data Variable Absolute No_Wrap Linear
                            Preferred_State No_Null_Position Volatile Bitfield
            Item(Global): Report ID, data= [ 0x11 ] 17
            Item(Local ): Usage, data= [ 0x07 ] 7
                            (null)
            Item(Global): Report Size, data= [ 0x08 ] 8
            Item(Global): Report Count, data= [ 0x3f ] 63
            Item(Main  ): Input, data= [ 0x82 ] 130
                            Data Variable Absolute No_Wrap Linear
                            Preferred_State No_Null_Position Volatile Bitfield
            Item(Global): Report ID, data= [ 0x04 ] 4
            Item(Local ): Usage, data= [ 0x08 ] 8
                            (null)
            Item(Global): Report Size, data= [ 0x08 ] 8
            Item(Global): Report Count, data= [ 0x10 ] 16
            Item(Main  ): Input, data= [ 0x82 ] 130
                            Data Variable Absolute No_Wrap Linear
                            Preferred_State No_Null_Position Volatile Bitfield
            Item(Main  ): End Collection, data=none
      Endpoint Descriptor:
        bLength                 7
        bDescriptorType         5
        bEndpointAddress     0x81  EP 1 IN
        bmAttributes            3
          Transfer Type            Interrupt
          Synch Type               None
          Usage Type               Data
        wMaxPacketSize     0x0040  1x 64 bytes
        bInterval               1
      Endpoint Descriptor:
        bLength                 7
        bDescriptorType         5
        bEndpointAddress     0x01  EP 1 OUT
        bmAttributes            3
          Transfer Type            Interrupt
          Synch Type               None
          Usage Type               Data
        wMaxPacketSize     0x0040  1x 64 bytes
        bInterval               1
Device Status:     0x0000
  (Bus Powered)
